Top queries,Clicks,Impressions,CTR,Position
kidrove,183,229,79.91%,1.14
kidrove.com,2,43,4.65%,4.74
ramadan carnival ajman,1,12,8.33%,4.42
police sports and shooting club ajman,1,2,50%,10
kids grove,1,1,100%,1
kids activity dubai,1,1,100%,5
indoor teen birthday party places near me,1,1,100%,11
eyfs schools in abu dhabi,0,101,0%,38.91
playtopia dubai,0,85,0%,9.78
nursery in abu dhabi,0,75,0%,79.32
best preschool,0,68,0%,48.65
preschool in abu dhabi,0,63,0%,38.62
kindergarten in abu dhabi,0,56,0%,56.91
playtopia,0,54,0%,9.33
best nursery in abu dhabi,0,46,0%,49.83
best preschool in abu dhabi,0,43,0%,16.63
kindergarten schools in abu dhabi,0,38,0%,67.87
ajman police club ramadan carnival,0,37,0%,5.57
eyfs nursery in abu dhabi,0,37,0%,36.54
ramadan street food festival karama 2026,0,35,0%,7.71
best kindergarten schools in abu dhabi,0,34,0%,41.06
day care in abu dhabi,0,33,0%,59.3
best kindergarten in abu dhabi,0,31,0%,46.13
art classes in dubai for kids,0,31,0%,47.87
preschool in al raha gardens,0,31,0%,54.52
art classes for kids,0,30,0%,43.6
kids birthday party places dubai,0,30,0%,61.8
playtopia town square,0,28,0%,10.54
preschool,0,28,0%,25.14
kindergarten abu dhabi,0,28,0%,73.29
art school for kids,0,27,0%,50.33
kids birthday party venues,0,27,0%,55.85
painting classes for kids,0,27,0%,62.78
birthday places in dubai for kids,0,26,0%,53.92
kids birthday party venues in dubai,0,26,0%,53.92
kids birthday party venues dubai,0,26,0%,55.77
karama food festival 2026,0,24,0%,9.5
best budget friendly daycare in baniyas,0,24,0%,10.67
nearby play schools,0,24,0%,20.46
iftar with kids play area,0,23,0%,9.13
drawing classes for kids in dubai,0,23,0%,50.52
painting classes for kids in dubai,0,23,0%,54.65
schools for 3 year olds near me,0,21,0%,27.81
pre kg schools in abu dhabi,0,21,0%,70
birthday parties for kids in dubai,0,19,0%,70.58
nearest preschool to me,0,18,0%,51.56
al majaz splash park ticket price,0,17,0%,8.76
nursery in umm al quwain,0,17,0%,8.82
school group outdoor activities dubai,0,17,0%,31.06
day care center in abu dhabi,0,17,0%,60.53
angels on high montessori abu dhabi reviews,0,16,0%,7.81
best nurseries in abu dhabi,0,16,0%,38
playschools near me,0,16,0%,42.38
orange wheels circle mall,0,14,0%,8.5
ajman carnival,0,14,0%,11.5
ramadan family activities uae,0,14,0%,16.64
preschools in abu dhabi,0,13,0%,24
daycare abu dhabi,0,13,0%,49.15
pre school near me,0,13,0%,69.69
abudhabi nursery,0,13,0%,74.54
pre school,0,12,0%,8.5
al majaz waterfront entry fee,0,12,0%,9.42
kids hq,0,12,0%,34.17
nursery schools in abu dhabi,0,12,0%,57.25
daycare in abu dhabi,0,12,0%,66.67
nursery near abu dhabi,0,12,0%,71.67
nurseries abu dhabi,0,12,0%,82.33
al hira beach sharjah timings,0,11,0%,2.55
al heera,0,11,0%,57.91
nursery school in abu dhabi,0,11,0%,62.64
kids birthday party venues near me,0,11,0%,72.09
preschool near by me,0,10,0%,67.9
kids birthday in dubai,0,10,0%,73.2
kids birthday dubai,0,10,0%,73.8
nursery abu dhabi,0,10,0%,77.7
ramadan district,0,9,0%,15.22
nursery for 5 year olds,0,9,0%,21
rain room sharjah tickets,0,9,0%,22.67
rain room tickets,0,9,0%,36.44
children birthday parties,0,9,0%,37.11
abu dhabi best nursery,0,9,0%,50.33
iftar with kids,0,8,0%,7.38
orange wheels - circle mall,0,8,0%,7.5
explore preschool,0,8,0%,7.88
midfa al iftar,0,8,0%,9.25
ramadan nights sharjah expo,0,8,0%,9.75
nurseries in fujairah,0,8,0%,12.12
best preschoo in khalifa city,0,8,0%,16.25
pre kg near me,0,8,0%,43.5
best preschoo in mushrif,0,7,0%,14.71
nearest playschool,0,7,0%,21.14
safest daycare in baniyas abu dhabi,0,7,0%,22.43
preschools,0,7,0%,28.43
best daycare in mussafah abu dhabi,0,7,0%,31
safest daycare in mussafah abu dhabi,0,7,0%,32.86
childcare abu dhabi,0,7,0%,44.29
scavenger hunt dubai,0,7,0%,47.29
kids daycare in abu dhabi,0,7,0%,57.29
nursery schools abu dhabi,0,7,0%,57.57
nursery in abu dhabi city,0,7,0%,60.57
daycare in abu dhabi residential area,0,7,0%,64.43
angels on high montessori abu dhabi,0,6,0%,11.33
plan a fun scavenger hunt in my area,0,6,0%,11.67
kids hq dubai,0,6,0%,28.17
best daycare in industrial area abu dhabi,0,6,0%,44.67
glow park dubai,0,6,0%,65.5
kids birthday parties dubai,0,6,0%,71.83
heera beach sharjah timings,0,5,0%,6.2
kids club umm al quwain,0,5,0%,7.6
orange wheels - circle mall reviews,0,5,0%,9.2
al jalila nursery - fujairah reviews,0,5,0%,10.4
police club ajman,0,5,0%,11.4
play schools in abu dhabi,0,5,0%,17.2
which nursery is best in abu dhabi,0,5,0%,27.2
preschool admission abu dhabi,0,5,0%,45.6
play school near me,0,5,0%,46.4
real madrid world dubai,0,5,0%,62.6
glow garden dubai,0,5,0%,70.6
pre schools near me,0,5,0%,77.8
nursery in abu dhabi near me,0,5,0%,83.2
kids nursery in yas island,0,5,0%,87.4
fairmont ajman iftar,0,4,0%,1
prekg schools,0,4,0%,5
kids hq umm suqeim,0,4,0%,6.5
ramadan district jumeirah emirates towers,0,4,0%,6.5
mommy and me nursery fujairah,0,4,0%,8.5
ramadan at jumeirah emirates towers,0,4,0%,9
safari iftar,0,4,0%,9
eataly cooking classes dubai,0,4,0%,10
best preschool near me,0,4,0%,11.75
ramadan district dubai,0,4,0%,12
best budget friendly daycare in mafraq,0,4,0%,13.5
how to choose the best nursery in abu dhabi,0,4,0%,14.75
kid hq,0,4,0%,15.75
montessori preschool abu dhabi,0,4,0%,19.75
best kg schools in abu dhabi,0,4,0%,21.25
play schools near me with fees,0,4,0%,27.5
prekg schools near me,0,4,0%,28
best daycare in shamkha abu dhabi,0,4,0%,33.25
dubai international art centre,0,4,0%,46.25
kids activities,0,4,0%,57
top preschools near me,0,4,0%,70.75
robotics for kids dubai,0,4,0%,77.75
best montessori preschool near me,0,3,0%,5
karama street food festival 2026,0,3,0%,5
ajman police ramadan carnival,0,3,0%,6.33
al majaz kids play area,0,3,0%,6.33
petits chefs dubai,0,3,0%,9
places to celebrate 11 year old birthday,0,3,0%,13
art center for kids in dubai,0,3,0%,17
best daycare in mafraq abu dhabi,0,3,0%,17.33
rain room dubai,0,3,0%,21.33
best nursery abu dhabi,0,3,0%,21.67
best daycare near me,0,3,0%,29
nursery school abu dhabi,0,3,0%,40.67
best daycare near mbz,0,3,0%,46.33
rain room,0,3,0%,49.33
safest daycare in shabiya 10,0,3,0%,49.33
preschool abu dhabi,0,3,0%,53.33
play school in abu dhabi,0,3,0%,56.67
dubai glow park,0,3,0%,58
orange wheels global village,0,3,0%,59.67
daycare in mussafah residential area,0,3,0%,61.67
creche near me,0,3,0%,63
nurseries in abu dhabi,0,3,0%,68
treasure hunt dubai,0,3,0%,83.67
family events,0,2,0%,1
montessori vs eyfs nurseries abu dhabi,0,2,0%,3
best pre kg schools near me,0,2,0%,6.5
affordable preschool,0,2,0%,7
al majaz waterfront kids play area,0,2,0%,7
eataly kids cooking class,0,2,0%,7
nursery for 1 year old,0,2,0%,7
al majaz park ticket price,0,2,0%,7.5
free local events happening this week,0,2,0%,7.5
iftar buffet with kids play area,0,2,0%,7.5
kids immersive experience,0,2,0%,8
apple tree nursery umm al quwain,0,2,0%,8.5
legoland dubai ramadan offer,0,2,0%,8.5
things to do in ajman at night,0,2,0%,8.5
best play school near me,0,2,0%,10
family days out near downtown dubai,0,2,0%,10
montessori preschool near me,0,2,0%,10
art learning center,0,2,0%,11.5
preschool near me within 400m,0,2,0%,11.5
circle mall play area,0,2,0%,12.5
top 10 nurseries in abu dhabi,0,2,0%,14
1st birthday party venues in dubai,0,2,0%,15
birthday party kids venues,0,2,0%,15
childrens party venue,0,2,0%,18
best preschoo in bateen,0,2,0%,20
childcare provider in abu dhabi,0,2,0%,21
family days out near downtown dubai with parking,0,2,0%,21
childrens birthday venues,0,2,0%,23
top cheap nurseries in abu dhabi,0,2,0%,24.5
interactive experiences,0,2,0%,25
cheap nurseries in abu dhabi,0,2,0%,34
playgroup nursery near me,0,2,0%,34.5
best nursery schools in abu dhabi,0,2,0%,44.5
indoor birthday party venues,0,2,0%,46.5
indoor kids birthday party,0,2,0%,47.5
kindergartens in abu dhabi,0,2,0%,49.5
birthday venues for kids,0,2,0%,51
kids birthday party places,0,2,0%,53.5
drawing classes for kids,0,2,0%,54.5
best kids clubs in uae,0,2,0%,57.5
best daycare near shabiya 11,0,2,0%,58.5
top daycare in shabiya 9,0,2,0%,61.5
art classes for kids near me,0,2,0%,73
lego spike essential dubai uae,0,2,0%,77
orange wheels dubai,0,2,0%,79
preschools near me,0,2,0%,80
nursery for toddlers,0,2,0%,82
nursery in muroor abu dhabi,0,2,0%,85.5
crocodile park,0,2,0%,94
ajman police shooting club price list,0,1,0%,1
al majaz waterfront tickets price,0,1,0%,1
almajaz splash park tickets,0,1,0%,1
best daycares near me,0,1,0%,1
birthday places for kids 10 years old,0,1,0%,1
children birthday party venues,0,1,0%,1
entertainment & shows,0,1,0%,1
flyer ride,0,1,0%,1
good birthday places for 10 year olds,0,1,0%,1
play area dubai,0,1,0%,1
preshool,0,1,0%,1
toy shop near me,0,1,0%,1
what we have to do in this,0,1,0%,1
ajman ramadan,0,1,0%,2
arabian night iftar,0,1,0%,2
art workshops for children,0,1,0%,2
esaad,0,1,0%,2
mall treasure hunt,0,1,0%,2
نادي الشرطة عجمان,0,1,0%,2
bab al shams,0,1,0%,3
in ajman,0,1,0%,3
nearest play school,0,1,0%,3
neon galaxy,0,1,0%,3
3 year old party places near me,0,1,0%,4
ajman police club,0,1,0%,4
al heerah beach,0,1,0%,4
crescere kids learning centre,0,1,0%,4
day care and play school near me,0,1,0%,4
preschool early learning,0,1,0%,4
what school is for 3 year olds,0,1,0%,4
art party for kids,0,1,0%,5
nearby play school for kids,0,1,0%,5
ramadan offers for kids,0,1,0%,5
best day care centers near me,0,1,0%,6
day care and preschool,0,1,0%,6
eatly workshop,0,1,0%,6
kids fashion show near me,0,1,0%,6
name for that,0,1,0%,6
picasso artists,0,1,0%,6
preeschool,0,1,0%,6
preschool school,0,1,0%,6
ramadan street food festival,0,1,0%,6
best platforms for booking kids activities,0,1,0%,7
majaz water park,0,1,0%,7
playtopia dubai reviews,0,1,0%,7
real madrid world timings,0,1,0%,7
storytelling workshop,0,1,0%,7
best place to celebrate 2 year old birthday,0,1,0%,8
birthday places for 11 year old girls,0,1,0%,8
family days out near dubai museum with ev charging,0,1,0%,8
good birthday places for 13 year olds,0,1,0%,8
loco bear,0,1,0%,8
more,0,1,0%,8
pre school programs for 3 year olds,0,1,0%,8
preschool centers near me,0,1,0%,8
presvhool,0,1,0%,8
ramadan tents,0,1,0%,8
al heera beach,0,1,0%,9
child care center fujairah,0,1,0%,9
childrens art classes,0,1,0%,9
cooking class eataly,0,1,0%,9
eataly cooking class,0,1,0%,9
where to celebrate 2 year old birthday,0,1,0%,9
ajman police sports and shooting club,0,1,0%,10
ajman saray iftar,0,1,0%,10
art birthday party,0,1,0%,10
art birthday party dubai,0,1,0%,10
eataly cooking classes,0,1,0%,10
expo sharjah timings,0,1,0%,10
iftar safari,0,1,0%,10
immersive experiences for kids,0,1,0%,10
junior's fashion week dubai,0,1,0%,10
leo&loona kids park tickets,0,1,0%,10
orange wheel circle mall,0,1,0%,10
ramadan carnival,0,1,0%,10
tree adventure park,0,1,0%,10
al majaz waterfront activities,0,1,0%,11
birthday places for 11 year olds,0,1,0%,11
circle mall kids play area,0,1,0%,11
family days out near area of downtown dubai,0,1,0%,11
in uae,0,1,0%,11
legoland ramadan offer,0,1,0%,11
list of nursery schools in abu dhabi,0,1,0%,11
loco bear laser tag,0,1,0%,11
nursery umm al quwain,0,1,0%,11
play school abu dhabi,0,1,0%,11
play school near me within 400m,0,1,0%,11
ajman police shooting club,0,1,0%,12
best preschool near me with fees,0,1,0%,12
family days out near hilton bur dubai with free wifi dubai,0,1,0%,12
fun places for birthday parties for teens,0,1,0%,12
ramadan nights expo centre sharjah,0,1,0%,12
al heera beach sharjah,0,1,0%,13
family and friends,0,1,0%,13
nursery for 4 year olds,0,1,0%,13
pre schools,0,1,0%,13
nursery for 2 year old,0,1,0%,14
oreschool,0,1,0%,14
ajman indoor activities,0,1,0%,15
nursery for 3 year old,0,1,0%,15
boys day out latest,0,1,0%,16
locobear game latest,0,1,0%,16
top rated daycare centers near me,0,1,0%,17
best kids birthday parties,0,1,0%,18
louvre abu dhabi events,0,1,0%,20
party at the zone,0,1,0%,20
ramadan nights festival,0,1,0%,20
things to do in abu dhabi with kids,0,1,0%,20
ajman shooting club,0,1,0%,21
best preschoo in al bateen,0,1,0%,22
daycare and preschool near me,0,1,0%,22
kids birthday party venue dubai,0,1,0%,22
early learning preschool near me,0,1,0%,24
junior fashion week,0,1,0%,25
fujairah montessori nursery,0,1,0%,26
discover activities in shopping malls,0,1,0%,28
kids party venues,0,1,0%,29
childrens birthday,0,1,0%,30
kids nursery abu dhabi,0,1,0%,32
children's birthday party venues,0,1,0%,33
best creche,0,1,0%,34
adventure hq al barsha,0,1,0%,35
best nurseries abu dhabi,0,1,0%,36
childrens birthday party venues,0,1,0%,36
summer art classes for kids,0,1,0%,38
kids zipline park dubai,0,1,0%,40
mall engagement activities,0,1,0%,40
top british nurseries in abu dhabi,0,1,0%,40
kids+birthday+party+venues,0,1,0%,43
kids events tomorrow,0,1,0%,45
aya universe dubai latest,0,1,0%,46
kidzania birthday party,0,1,0%,46
rain room uae,0,1,0%,48
affordable daycare near baniyas,0,1,0%,50
childrens activities,0,1,0%,51
nursery in yas island,0,1,0%,51
after school activities,0,1,0%,54
preschool near me,0,1,0%,55
day care abu dhabi,0,1,0%,56
pre kg schools near me,0,1,0%,56
art classes for kindergarteners near me,0,1,0%,58
kids birthday party dubai,0,1,0%,59
best private pre k schools near me,0,1,0%,62
preschools in near me,0,1,0%,62
best play schools near me,0,1,0%,63
safest daycare in shabiya 9,0,1,0%,65
kids drawing classes,0,1,0%,66
near me play schools,0,1,0%,66
pre preschools near me,0,1,0%,66
kids workshop,0,1,0%,67
orange wheels nakheel mall,0,1,0%,67
birthday party with play area,0,1,0%,68
puremindsacademy,0,1,0%,68
dubai glow garden timings,0,1,0%,70
al heerah suburb sharjah,0,1,0%,71
montessori preschools near me,0,1,0%,71
best nursery school near me,0,1,0%,72
garden glow park,0,1,0%,75
real madrid world,0,1,0%,75
cheap nursery in abu dhabi,0,1,0%,76
good nursery near me,0,1,0%,76
dubai garden glow park,0,1,0%,77
best toddler programs,0,1,0%,80
happy fun mushrif park,0,1,0%,81
preschool in near me,0,1,0%,82
dubai glow,0,1,0%,84
lego spike essential dubai,0,1,0%,85
family days out near dubai museum with free breakfast,0,1,0%,86
activity park,0,1,0%,88
indoor birthday party places,0,1,0%,90
pottery for kids,0,1,0%,91
free kids events,0,1,0%,93
scramble indoor play,0,1,0%,95
best nursery for toddlers,0,1,0%,99
glow village dubai,0,1,0%,99